Title,main_category,category,date,description
Lindsey Graham Warns Of 'Riots In Streets' If Trump Is Charged Over Classified Docs,News,POLITICS,2022-08-29,republican including believe come trump law graham said fox news getting
Amber Heard's Sister Reacts To 'Disgusting' Johnny Depp Cameo At VMAs,News,ENTERTAINMENT,2022-08-29,actor appeared virtually mtv video music award moon person sunday night
Johnny Depp Makes Surprise Appearance As Moon Person At MTV VMAs,News,ENTERTAINMENT,2022-08-29,actor made first appearance since defamation verdict amber heard june
And The Award For Most Enthusiastic VMAs Guest Goes To Taylor Swift,News,ENTERTAINMENT,2022-08-29,singer channeled inner barb danced along lizzo fangirled blackpink
"Pakistan Flooding Deaths Pass 1,000 In 'Climate Catastrophe'",News,WORLD NEWS,2022-08-28,pakistani authority reported casualty since monsoon season began earlier normal year destroying nearly home
2022 MTV VMAs Red Carpet: All The Wildest Looks You Need To See,News,ENTERTAINMENT,2022-08-28,celebrity showed showed award sunday night new jersey
A Nebraska Man Conducted An Active Shooter Drill. Employees Had No Idea.,News,U.S. NEWS,2022-08-28,man hired organize looked like mass shooting charged multiple terrorism count
Kash Patel Says His Life's In Danger Because He's In FBI Affidavit,News,POLITICS,2022-08-28,message posted truth social patel called attack
FBI Probing Russian-Speaking Fake Heiress Who Infiltrated Mar-A-Lago: Report,News,POLITICS,2022-08-28,startling case underscore security challenge donald resort even former president stashed government file
Arcade Fire Singer Win Butler Accused Of Sexual Misconduct By Several People: Report,News,ENTERTAINMENT,2022-08-28,butler told pitchfork consensual relationship outside marriage disputed detail allegation
Don Jr. Posts 'Dick Pic' Of Dad After Affidavit Release: 'Redact This!',News,POLITICS,2022-08-27,hang president goof one fan
Trump Attorneys File Do-Over Motion Regarding Mar-A-Lago Search,News,POLITICS,2022-08-27,former president legal team followed judge order polish filing fbi seizure government document estate
"6 Missing College Students In Mexico Were Held In Warehouse, Killed By Army",News,WORLD NEWS,2022-08-27,six student kidnapped kept alive day handed local army commander ordered killed according new report
A Fisherman Thought He Caught A Rock. He Snagged A Prehistoric Treasure Instead.,News,WEIRD NEWS,2022-08-27,nebraska man said initially believed underwater find skeleton catfish deer
Jared Kushner Blasts 'Nasty Troll' Chrissy Teigen For Attacks On Ivanka,News,POLITICS,2022-08-27,nasty
'Kimmel' Host Nikki Glaser Absolutely Goes There In Scorching NSFW Monologue,News,ENTERTAINMENT,2022-08-26,one safe speed roast targeting politician
Mar-A-Lago Search Affidavit: Trump Was Insecurely Storing Most Sensitive Intel At Club,News,POLITICS,2022-08-26,heavily redacted document lay justification department justice provided judge permission search seize highly classified document fbi raid trump florida home
"Donald Trump's Truth Social Reportedly Faces Major Money, Trademark Woes",News,POLITICS,2022-08-26,major vendor claim stiffed trump social medium operation suggesting finance significant disarray reported fox business
FINISH HIM: Fighting Kangaroo Pulls Wild Move Right Out Of A Video Game,News,WEIRD NEWS,2022-08-26,two mad marsupial went canberra nature reserve
"6 Months Into War, Russian Goods Still Flowing To U.S.",News,WORLD NEWS,2022-08-25,american company including federal contractor continue buy everything birch wood flooring titanium russian corporation
Judge Temporarily Blocks North Dakota Trigger Law Banning Abortion,News,POLITICS,2022-08-25,ban set take effect friday two month supreme court overturned roe wade
REI Workers At Berkeley Store Vote To Unionize In Another Win For Labor,News,BUSINESS,2022-08-25,follow footstep rei worker new york city formed union earlier year
Gov. Brian Kemp Fights Subpoena In Georgia Election Probe,News,POLITICS,2022-08-25,judge presiding special grand jury investigating possible illegal attempt influence election georgia
JapanÂs National Police Chief To Resign Over Shinzo Abe Assassination,News,WORLD NEWS,2022-08-25,national police agency chief itaru nakamura announcement came agency released report failed protect abe life july
"Uvalde Victims' Families, Survivors Plan Multi-Billion Dollar Lawsuit",News,U.S. NEWS,2022-08-24,lawsuit look name law enforcement agency shop accused shooter bought gun used uvalde shooting
"Dan Goldman, Narrowly Leading In New York Democratic Primary, Declares Victory",News,POLITICS,2022-08-24,congressional race officially called rival niou declined concede
Markwayne Mullin Wins Oklahoma Republican Primary To Succeed GOP Sen. Jim Inhofe,News,POLITICS,2022-08-24,house member known staunch president biden critic loyal donald trump supporter
Charlie Crist Wins Chance To Take On Florida Gov. Ron DeSantis And His $132 Million,News,POLITICS,2022-08-24,crist making second run governor democrat served one term job republican decade ago
IRS Launches Safety Review Amid Threats To Workers Linked To Conspiracy Theories,News,POLITICS,2022-08-24,internal revenue service say conducting comprehensive review safety facility
Student Loan Borrowers Await Biden Plan On Debt Forgiveness,News,POLITICS,2022-08-24,biden plan survives legal challenge almost certain come could offer windfall swath nation fall midterm election
'House Of The Dragon' Is Already Ratings King After Most-Watched HBO Premiere Ever,News,ENTERTAINMENT,2022-08-23,game throne spinoff pulled largest audience original series premiere hbo history
Former Louisville Cop Pleads Guilty In Breonna Taylor Case,News,U.S. NEWS,2022-08-23,former louisville police detective helped falsify warrant led deadly police raid apartment pleaded guilty federal charge
"Jerry Allison, Buddy Holly's Drummer, Dead At 82",News,ENTERTAINMENT,2022-08-23,rock roll hall fame member also classic song like
Andrew Garfield Confirms Method Acting Is Possible Without 'Being An Asshole',News,ENTERTAINMENT,2022-08-23,actor revealed abstained sex month starved prepare role
Rusty Bowers Rips 'Fascism' Of GOP And Trump's Strong-Arm Tactics To Trash Vote,News,POLITICS,2022-08-23,hanged yet arizona gop leader told guardian powerful interview holy moly crazy place lost
"After Delay, Biden Readies Student Loan Help, Payment Pause",News,POLITICS,2022-08-23,precise detail president joe plan kept unusually small circle within biden administration
This Is The Bittersweet Part Of Democrats' Sweet Legislative Victory,News,POLITICS,2022-08-22,democrat cusp transforming paid leave child care home care figuring came short might get opportunity try
UK Broadcaster To Air Satirical Musical On Prince Andrew,News,WORLD NEWS,2022-08-22,program described life duke set musical score
Teachers In Ohio's Largest School District Go On Strike,News,POLITICS,2022-08-22,class scheduled resume two day
"Ukraine: 9,000 Of Its Troops Killed Since Russia Began War",News,WORLD NEWS,2022-08-22,russian invasion ukraine began
"Gas Prices Are Falling, But Global Events Could Cause Increase, Energy Secretary Warns",News,POLITICS,2022-08-22,jennifer granholm said produce record amount oil next year
Police File Terrorism Charges Against Pakistan's Ex-Premier Imran Khan,News,WORLD NEWS,2022-08-22,charge accuse khan threatening police officer judge sedition act
Minneapolis Teacher Contract Race Language Ignites Firestorm,News,EDUCATION,2022-08-21,minneapolis teacher settled strike earlier year celebrated groundbreaking provision new contract meant shield teacher color traditional layoff
Hawaii Seeking End To Conflict Over Astronomy On Sacred Mountain,News,U.S. NEWS,2022-08-21,native hawaiian say use sacred mauna kea summit scientist
Metal-Detecting Stranger Retrieves WomanÂs Ring Lost In Sea,News,U.S. NEWS,2022-08-21,francesca teal plea help facebook got attention local man spent two day searching water wetsuit headlamp metal detector
"Leon Vitali, Stanley KubrickÂs Right-Hand Man, Dies At 74",News,ENTERTAINMENT,2022-08-21,leon vitali actor became one stanley closest associate died
ÂDragon Ball SuperÂ Bests ÂBeastÂ At Box Office With $20.1M,News,ENTERTAINMENT,2022-08-21,idris elba may go lion action flick match latest movie
Defense In Parkland School ShooterÂs Trial Set To Present Its Case,News,U.S. NEWS,2022-08-21,nikolas cruz attorney monday present carried attack make case life prison instead death
"Judge Won't Block Georgia Ban On Bringing Food, Water To Voters In Line",News,POLITICS,2022-08-20,voting right group dismayed ruling upholds ban giving drink snack people waiting vote
"Trans Woman Can't Be Considered Parent Of Her Own Child, Rules Tokyo Court",News,WORLD NEWS,2022-08-20,court said woman legal parent daughter born transition one born afterward
"Dorli Rainey, Symbol Of Occupy Movement, Dies At 95",News,U.S. NEWS,2022-08-20,seattle activist turned racial justice affordable housing demonstration year
Mike Pence Says He Did Not Take Classified Documents When He Left Office,News,POLITICS,2022-08-20,former vice president made disclosure fbi agent seized classified top secret document donald trump florida home
Wendy's Pulls Lettuce From Sandwiches After Dozens Fall Sick From E. Coli,News,U.S. NEWS,2022-08-20,chain say pulling lettuce sandwich restaurant michigan ohio pennsylvania people eating reported falling ill
Shocking Drone Video Shows Alligator Attacking Florida Man,News,U.S. NEWS,2022-08-19,gator bite enough crush portion man skull break jaw
How To Tell If Your Chest Pain Is A Heart Problem,News,WELLNESS,2022-08-19,concerned chest pain might look sign know dealing whether need reach doctor asap
Mitch McConnell Gives Downbeat Forecast On GOP Winning Senate,News,POLITICS,2022-08-19,senate gop leader cited candidate quality factor whether republican win control november election
Vanessa Bryant Says Kobe Bryant Crash Photos Turned Grief To Horror,News,SPORTS,2022-08-19,bryant widow testified life fear every day photo husband death pop social medium
Rapper Young Thug Again Denied Bond In Racketeering And Gang Case,News,ENTERTAINMENT,2022-08-19,young thug along rapper gunna one dozen men charged georgia racketeering gang case
Media To Ask Judge To Release Trump Search Warrant Affidavit,News,POLITICS,2022-08-18,matter one utmost public interest involving action current former government official wrote attorney medium company
State Dept. 'Studying' 34-Year Sentence Of Saudi Woman Over Twitter Use,News,WORLD NEWS,2022-08-18,salma received lengthy prison sentence following account retweeting post critical kingdom twitter
"LGBTQ Pride Events Will Have Priority Access To Monkeypox Vaccines, Health Officials Say",News,U.S. NEWS,2022-08-18,extra vaccine dos made available city like atlanta new orleans pride celebration scheduled later year
"Trump Org. CFO To Plead Guilty, Testify Against Company",News,CRIME,2022-08-18,allen weisselberg charged taking million compensation trump organization several year
Deshaun Watson Settles With NFL For 11-Game Suspension,News,SPORTS,2022-08-18,cleveland brown quarterback accused sexual misconduct two dozen woman played houston texan
'Mike' And The Flawed Allure Of Authorized Biopics,News,CULTURE & ARTS,2022-08-18,biography long considered gold standard take consideration curated
Talks On Possible Watson Settlement Progress,News,SPORTS,2022-08-17,two people familiar negotiation tell ap talk nfl nfl player association discipline settlement cleveland brown quarterback deshaun watson progressed
CDC Director To Overhaul Agency With COVID Shortcomings In Mind,News,POLITICS,2022-08-17,rochelle walensky announced reset organization amid public criticism response coronavirus monkeypox
"General Motors Recalls Over 484,000 Vehicles Over 'Improperly'-Formed Seat Belts",News,U.S. NEWS,2022-08-17,automaker said aware crash injury result seat belt
Planned Parenthood To Spend Record $50 Million For Midterms,News,POLITICS,2022-08-17,nation leading reproductive health care provider pouring money contest access abortion ballot
"Former California Congressman Charged After 'Multiple Fraud Schemes,' Feds Say",News,U.S. NEWS,2022-08-17,terrance cox democrat represented congressional district january january
Syria Denies It Is Holding American Journalist Austin Tice,News,WORLD NEWS,2022-08-17,president joe biden accused syrian government detaining austin tice missing year
NBA Won't Host Election Day Games In Effort To Increase Voter Turnout,News,POLITICS,2022-08-16,many american living state strict voter suppression law election day chance cast ballot
Dog Catches Monkeypox In France In First Suspected Human-To-Pet Transmission,News,U.S. NEWS,2022-08-16,finding prompt debate need isolate pet monkeypox individual researcher wrote
The Denver BroncosÂ Historic Purchase Could Increase Number Of Minority-Owned NFL Teams,News,SPORTS,2022-08-16,bronco quarterback russell wilson said new ownership group includes two black woman major move diversity nfl
New Law Makes Period Products Free For All In Scotland,News,WORLD NEWS,2022-08-16,period product act say school university government building must make tampon pad available free bathroom
Tiger To Meet With Top Players Against LIV Golf,News,SPORTS,2022-08-16,pga tour delaware first time tiger wood
Afghanistan Marks One-Year Anniversary Since Taliban Takeover,News,WORLD NEWS,2022-08-16,poverty spiking woman right decimated
"Lindsey Graham Must Testify In Georgia Election Probe, Judge Says",News,POLITICS,2022-08-15,graham argued provision constitution provides absolute protection senator questioned legislative act
'Another World' Soap Star Robyn Griggs Dies At 49,News,ENTERTAINMENT,2022-08-15,actor known role life live previously revealed cervical cancer diagnosis
3 Injured In Shooting At Six Flags Great America Park Near Chicago,News,U.S. NEWS,2022-08-15,three people hurt parking lot outside six flag great america gurnee illinois shot fired vehicle
Iran Denies Involvement But Justifies Salman Rushdie Attack,News,WORLD NEWS,2022-08-15,iran focused writer recent year fatwa demanding killing still stand
Lawyers Appeal Brittney Griner's Russian Prison Sentence,News,WORLD NEWS,2022-08-15,lawyer american basketball star said griner conviction sentence excessive
Jury Selection In R. Kelly Federal Trial To Begin In Chicago,News,U.S. NEWS,2022-08-15,r b singer face charge rigged state child pornography trial
Palestinian Gunman Wounds 8 In Late-Night Jerusalem Shooting,News,WORLD NEWS,2022-08-14,attack jerusalem followed tense week israel palestinian gaza west bank
ÂBullet TrainÂ Repeats No. 1; ÂTop GunÂ Flies Back Up Ranks,News,ENTERTAINMENT,2022-08-14,brad pitt action film led movie ticket sale second straight weekend
Officials: Fire At Coptic Church In Cairo Kills 41,News,WORLD NEWS,2022-08-14,one worst fire tragedy egypt recent year
Don't Look Up! A Possible Meteor Causes Loud 'Boom' Sound In Utah,News,U.S. NEWS,2022-08-14,national weather service salt lake city office wrote likely picked meteor trail
"Salman Rushdie 'On The Road To Recovery,' Agent Says",News,WORLD NEWS,2022-08-14,author agent said road two day suffering serious injury stabbing lecture upstate new york
"'Catastrophic Failure' At Research Center Kills About 21,000 Fish",News,ENVIRONMENT,2022-08-13,university california davis investigating led death ten thousand fish including chinook salmon
Parents Arrested After Attempting To Grab Their Children During School Lockdown,News,U.S. NEWS,2022-08-13,police reportedly used stun gun least two parent arrived kid report armed man school campus
Sinema Took Wall Street Money While Killing Tax On Investors,News,POLITICS,2022-08-13,democratic kyrsten sinema arizona received nearly million campaign contribution past year private equity professional hedge fund manager venture capitalist whose interest staunchly defended congress
Video Shows NFL Player Hopping Into Stands To Stop Fighting Fans,News,SPORTS,2022-08-13,moore cameo took place fan fest event organized carolina panther
Suspect In Rushdie Stabbing Pleads Not Guilty As Author Remains Hospitalized,News,U.S. NEWS,2022-08-13,suspect identified new jersey man hadi matar
'Shocking' Fish Die-Off Sends Poland Scrambling To Determine Source,News,ENVIRONMENT,2022-08-13,polish prime minister mateusz morawiecki suspect amount chemical waste dumped country second largest river
Cleveland Browns QB Deshaun Watson Apologizes ÂTo All The Women I Have ImpactedÂ,News,SPORTS,2022-08-12,qb accused two dozen woman sexual misconduct massage therapy session
"Over $2 Billion Announced For Roads, Bridges, Bike Lanes Across U.S.",News,POLITICS,2022-08-12,numerous transportation project across getting slice billion new federal funding
"Polio Detected In NYC's Sewage, Suggesting Virus Circulating",News,U.S. NEWS,2022-08-12,health official say virus cause polio detected new york wastewater week case polio identified north city
DemocratsÂ Inflation Reduction Act Expected To Do Little To Reduce Inflation,News,POLITICS,2022-08-12,bill also touted lowering deficit much uncertain
"CDC Drops Some Quarantine, Screening Recommendations For COVID-19",News,U.S. NEWS,2022-08-11,long social distancing
Feathers Fly As Wild Turkey Dodges Cops In Slapstick Apartment Chase,News,WEIRD NEWS,2022-08-11,one officer used net attempt nab turkey shuffled around apartment friday
Steve Martin Says ÂOnly Murders In The BuildingÂ Could Be His Final Role,News,ENTERTAINMENT,2022-08-11,legendary comedian actor latest tv show multiple emmy year
Officials: NH Missing Girl Case Shifts To Homicide Probe,News,CRIME,2022-08-11,authority say search new hampshire girl disappeared age reported missing late last year considered homicide investigation
U.S. Unemployment Claims Rise To Highest Level Since November,News,U.S. NEWS,2022-08-11,application jobless aid climbed risen five last six week labor department reported
Gas Prices Dip Just Below $4 For The First Time In 5 Months,News,U.S. NEWS,2022-08-11,falling price gas airline ticket clothes giving consumer bit relief although inflation still close high
"As Joe Biden Wins Mount, 2024 Doubts Ease For Top House Dems",News,POLITICS,2022-08-10,two veteran new york democrat previously dodged question whether president run reelection
FX's 'Justified' Set Faces Violent Interruption For Second Time In 3 Weeks,News,ENTERTAINMENT,2022-08-10,chicago police said person threw toward set south loop neighborhood
Ex-Twitter Staffer Convicted For Sharing Private Information On Dissidents With Saudis,News,U.S. NEWS,2022-08-10,ahmad abouammo received cash payment gift return providing information saudi account critical kingdom
Stranded Whale Euthanized After Removal From French River,News,WORLD NEWS,2022-08-10,veterinarian said rescue operation dangerously thin white mammal began breathing difficulty
Sesame Place To Train Workers On Diversity After Lawsuit,News,U.S. NEWS,2022-08-10,sesame park announced implementation diversity inclusion training employee
Kobe Bryant Crash Photos Lawsuit To Be Heard By LA Jury,News,U.S. NEWS,2022-08-10,vanessa bryant life fear child one day confront horrific image loved one online lawsuit say
Why The Justice Department CanÂt Say More About The Mar-A-Lago Raid,News,POLITICS,2022-08-09,donald trump
Lawyer: Rudy Giuliani WonÂt Testify Tuesday In Georgia Election Probe,News,POLITICS,2022-08-09,special grand jury atlanta investigating whether former president donald trump others illegally tried interfere general election state
Idris Elba Reveals How He 'Hustled' His Way Onto Jay-Z's 'American Gangster' Album,News,ENTERTAINMENT,2022-08-09,american gangster actor told jimmy fallon wrote poem ended film companion album
Judge: 3 Players Who Joined Saudi-Backed Golf Tour Can't Compete In PGA Postseason,News,SPORTS,2022-08-09,three suspended golfer joined liv golf wo allowed compete pga tour postseason
Broncos Make History After Being Sold For Record $4.65 Billion,News,SPORTS,2022-08-09,record billion sale denver bronco walmart heir rob walton daughter unanimously approved nfl owner
3 Dead In Shooting At Florida Narcotics Anonymous Meeting,News,U.S. NEWS,2022-08-09,man went meeting killed friend shooting police say
Trump Said Wounded Veterans In Military Parades DidnÂt 'Look Good' For Him: Book,News,POLITICS,2022-08-08,hero john kelly reportedly responded trump new book journalist peter baker susan glasser
Lindsey Graham Scolded For Senate Outburst At Maggie Hassan,News,POLITICS,2022-08-08,graham directly insulted hassan presiding officer chris murphy stepped
Albuquerque Police Share Photo Of Car Eyed In Slayings Of Muslim Men,News,CRIME,2022-08-08,authority said four killing several thing common looking see crime could related
"ÂCome On, Bernie!Â Why Democrats Left Child Tax Credit Out Of The Inflation Reduction Act",News,POLITICS,2022-08-08,hope restoring child benefit appears bipartisan negotiation mitt romney
"How To Hide Even The Worst Tan Lines, According To Makeup Pros",News,STYLE & BEAUTY,2022-08-08,quick solution fix tan body makeup self tanner
"57 Votes in the Senate: Enough For Private Equity, Not Enough For Diabetics",News,POLITICS,2022-08-08,latest example senate rule help powerful
Brad PittÂs ÂBullet TrainÂ Pulls Into Station With $30.1M,News,ENTERTAINMENT,2022-08-07,stylized action romp starring brad pitt arrived million opening weekend
'The Flash' Movie Still Set For Release Despite Ezra Miller's Controversies,News,ENTERTAINMENT,2022-08-07,warner discovery ceo david zaslav recently teased film upcoming release spite miller arrest various allegation star
Biden Expresses Solidarity With Muslim Community After Albuquerque Killings,News,POLITICS,2022-08-07,president joe response come two day fourth muslim man found dead new mexico governor called targeted attack
L.A. Man Among 3 Killed In Lightning Strike Near White House,News,U.S. NEWS,2022-08-07,los angeles bank executive one three people killed last week lightning struck park across white house
"Over 120 Injured, Several Missing In Massive Cuban Oil Facility Fire",News,WORLD NEWS,2022-08-07,dense black smoke cloud fire spread mile west toward havana
Eastern Kentucky Braces For More Storms While Recovering From Extreme Flooding,News,U.S. NEWS,2022-08-07,national weather service extended flood watch area eastern kentucky said threat thunderstorm region much coming week
Woody Harrelson Reacts To Viral Photo Of DoppelgÃ¤nger Baby With Sweet Poem,News,ENTERTAINMENT,2022-08-06,danielle grier mulvenna tweeted photo smiling baby girl noted eerie resemblance woody harrelson actor took notice
Albuquerque Police Tell Muslim Community To Be 'Vigilant' Amid Series Of Murders,News,CRIME,2022-08-06,police searching shooter shooter believed responsible string murder around new mexico city
Canadian Man Uses Giant Billboard To Get Rid Of Leftover Dairy Product In Fridge,News,WEIRD NEWS,2022-08-06,man recently moved toronto wanted part way item big way
New York Couple Turns In 5-Foot Gator 'Zachary' They'd Been Keeping In Home,News,ENVIRONMENT,2022-08-06,zachary headed sanctuary better life ahead
This Is The Most Underappreciated Part Of The Democratic Prescription Drug Bill,News,POLITICS,2022-08-06,medicare recipient spend year lifesaving medication could change
GOP Senators Refuse To Rule Out Supporting Donald Trump Again Â Even If He's Indicted,News,POLITICS,2022-08-06,reportedly criminal investigation many senate republican taking stance
CPAC Has A Special Exhibit: A Sobbing Jan. 6 Rioter In Jail,News,POLITICS,2022-08-05,dancing stand around watch guy cry said one journalist describing bizarre scene
"5 Dead, 8 Injured In Fiery Los Angeles Crash After Speeding Car Runs Red Light",News,U.S. NEWS,2022-08-05,crash killed infant pregnant woman unborn child occurred near gas station windsor hill neighborhood
Trevor Noah Busts Putin For 'Another S**tty Thing' He's Doing To Screw With U.S.,News,ENTERTAINMENT,2022-08-05,daily show host call russia latest tactic
French Scientist Trolls Twitter By Claiming Chorizo Slice Is Actually A Distant Star,News,WEIRD NEWS,2022-08-05,never sausage star
Fertility Treatment Puts Many Families In Debt. Here's How To Manage It.,News,WELLNESS,2022-08-05,expert share advice easing financial burden ivf costly procedure
FBI Arrests 4 Louisville Cops In Breonna Taylor Shooting Investigation,News,U.S. NEWS,2022-08-04,officer accused using false information obtain search warrant led taylor killing
'Cafeteria Workers Do A Lot More Than People Realize',News,FOOD & DRINK,2022-08-04,many school employee quietly go beyond job description stacey truman show look like
WhatÂs Going On With HBO Max? HereÂs What We Know So Far.,News,CULTURE & ARTS,2022-08-04,speculation potentially drastic cut hbo max left viewer subscriber panicking future streaming platform
John Legend Says Kanye's Support Of Trump Ruined Their Friendship,News,ENTERTAINMENT,2022-08-04,singer said rapper support trump presidential run became much u sustain friendship
Demi Lovato Appears To Call Out Ex Wilmer Valderrama Over Age Gap In New Song,News,ENTERTAINMENT,2022-08-04,number told stop lovato sings snippet unreleased new track
Giant Sinkhole Swallows Chilean Land Owned By Canadian Mining Company,News,WORLD NEWS,2022-08-03,national service geology mining first became aware sinkhole saturday
Selena Gomez Developing Reboot Of '80s Classic 'Working Girl',News,ENTERTAINMENT,2022-08-03,beloved comedy starred melanie griffith harrison ford sigourney weaver getting reboot treatment
Volcano Near IcelandÂs Main Airport Erupts Again,News,WORLD NEWS,2022-08-03,icelandic meteorological office urged people go near fagradalsfjall volcano
Paul Pelosi Pleads Not Guilty To DUI Charges,News,POLITICS,2022-08-03,husband house speaker nancy pelosi charged driving influence may car crash california
