Title,main_category,category,date,description
Brad Pitt Defends Ana De Armas After Marilyn Monroe Accent Backlash,News,ENTERTAINMENT,2022-08-03,come de armas answer pitt
Hilary Duff's Husband Calls Out Candace Cameron Bure For Ignorant TikTok,News,ENTERTAINMENT,2022-08-02,musician matthew koma pointed july post patriotic thought
Sandy Hook Parent Testifies: Alex JonesÂ Apologies ÂAre WorthlessÂ,News,U.S. NEWS,2022-08-02,defamation trial jones sandy hook parent neil heslin said infowars conspiracist lit match started fire
Bandit The 'Guard Cat' Hailed As Hero After Thwarting Would-Be Robbery,News,WEIRD NEWS,2022-08-02,least two people tried break tupelo mississippi home last week cat everything could alert owner
"Senate Republicans Fold, Help Pass Veterans Health Bill After Blocking It",News,POLITICS,2022-08-02,pact act help veteran suffering illness caused toxic burn pit head desk
University of West Georgia Professor Charged With Murder Of Incoming Freshman,News,CRIME,2022-08-02,anna jones sitting parked car friend shot
"I Cooked For The World's 1%, But I Traded It To Make School Lunches",News,FOOD & DRINK,2022-08-01,dan giusti changing way institution like school prison senior center think food learned far
Arizona's Rusty Bowers Comes Out Against A 2024 Trump Bid,News,POLITICS,2022-08-01,state house speaker testified committee investigating trump effort cling power
"Yolanda Hadid Returns To Social Media After 9-Month Break For Depression, Lyme Relapse",News,ENTERTAINMENT,2022-08-01,hadid last post break october month accused gigi zayn malik shoving
Challenger Suraj PatelÂs Poll Shows Tightening Race In Key New York Primary,News,POLITICS,2022-08-01,patel taking carolyn maloney jerry nadler democratic nomination manhattan congressional district
"Chris Rock Has No Real Interest In Talking With Will Smith, Sources Say",News,ENTERTAINMENT,2022-08-01,clearly something bother chris need deal issue chris fine one insider told
4 'Micro-Transitions' In Your Day That May Be Causing You Anxiety,News,WELLNESS,2022-08-01,certain point day spark stress without even realizing deal
Death Toll In Kentucky Hits 28 As Infrastructure Damage Hampers Flood Recovery,News,U.S. NEWS,2022-07-31,number death massive flooding kentucky continued climb amid threat heavy rain
Vulnerable House Dems See Abortion As Winning Campaign Theme,News,POLITICS,2022-07-31,supreme court decision abortion scrambled political dynamic heading november election control congress stake
Report: Prince Charles' Charity Got Donation From Bin Ladens,News,WORLD NEWS,2022-07-31,prince charitable fund accepted million pound million donation relative osama bin laden newspaper reported
ÂDC League Of Super-PetsÂ Takes No. 1 With $23 Million,News,ENTERTAINMENT,2022-07-31,superhero spinoff dog knocked jordan second place
New York City Declares Monkeypox A Public Health Emergency,News,U.S. NEWS,2022-07-31,many new york city resident could risk monkeypox infection according city official
Chinese Rocket Debris Makes Out-Of-Control Fall Back To Earth,News,SCIENCE,2022-07-31,video show people apparently spotting rocket burning debris night sky malaysia
Man Arrested For Alleged Bomb Threat Against Arizona Election Official After Jan. 6,News,U.S. NEWS,2022-07-30,james clark allegedly researched kill katie hobbs threatening arizona democratic secretary state explosive device
Rain Cascades From Vegas Casino Ceilings As Thunderstorms Flood Desert,News,ENVIRONMENT,2022-07-30,part parched southwest hit flood multiple people needing rescue nevada arizona
Photos Reveal Ivana Trump's Final Resting Place At Bedminster Golf Course,News,U.S. NEWS,2022-07-30,plot near first tee clubhouse new york post report
Ex-DHS Aide Suggests She 'Went Very Public' Because She Didn't Trust Inspector General,News,POLITICS,2022-07-30,olivia troye quit administration appeared call trump official embroiled secret service scandal
DHS Watchdog Fails To Notify Congress Over Missing Jan. 6 Texts Of 2 Trump Officials,News,POLITICS,2022-07-29,phone homeland security leader chad wolf ken cuccinelli reportedly wiped much like trump secret service agent
'Covington Kid' Nicholas Sandmann Loses Defamation Suits Against Major Media Outlets,News,U.S. NEWS,2022-07-29,sandmann footage native american elder went viral lost several outlet including new york time abc news
Alabama Official Told Reporter Her Skirt Was Too Short To Witness An Execution,News,POLITICS,2022-07-29,ivana hrynkiw ultimately allowed witness killing joe nathan james executed wish family member
Kenan Thompson: Ending 'SNL' After 50th Season 'Might Not Be A Bad Idea',News,ENTERTAINMENT,2022-07-29,cast member said lorne michael rumored departure could affect quality show
Principal Of Texas School Where Shooting Happened Reinstated,News,U.S. NEWS,2022-07-29,reinstatement came mandy gutierrez disputed finding developed uvalde school
Infowars Sidekick Owen Shroyer Testifies In Alex Jones' Sandy Hook Defamation Trial,News,U.S. NEWS,2022-07-28,shroyer peddled false story infowars neil heslin hold dead child massacre sandy hook elementary
BeyoncÃ© Shares Rare Glimpse Of All 3 Kids In Never-Before-Seen Photo,News,ENTERTAINMENT,2022-07-28,music superstar gave fan adorable look blue rumi sir carter ahead release new album renaissance
Democrats' Reconciliation Package The 'Biggest Climate Action In Human History',News,POLITICS,2022-07-28,deal democrat struck late thursday includes historic billion clean energy climate investment also requires new oil gas leasing
Deputy Kills Unarmed Black Man After Alleged Shoplifting From Houston Dollar General,News,POLITICS,2022-07-27,footage show harris county office deputy chasing man pinning hitting stun gun shooting back
Chris Cuomo Returning To Cable News After CNN Ouster,News,MEDIA,2022-07-27,former head cnn show taken job host newsnation
2 Cops Sentenced For Violating George Floyd's Rights,News,U.S. NEWS,2022-07-27,federal government brought civil right charge four officer may month chauvin convicted murder manslaughter state court
GOP Sen. Joni Ernst Blocks Bill Protecting Right To Birth Control,News,POLITICS,2022-07-27,republican lawmaker celebrating end nationwide abortion right blocking federal protection birth control
Should I Take My Cat Out In This Heat?,News,WELLNESS,2022-07-27,certain temperature dangerous pet expert share precaution tip take care feline friend heat wave
'Stranger Things' Star Joseph Quinn Detained By Customs Agent Demanding Season 5 Return,News,ENTERTAINMENT,2022-07-26,british actor play eddie munson said snared way tonight show jimmy fallon
